{
  "$schema": "https://json-schema.org/draft/2020-12/schema",
  "$id": "https://github.com/SeannyQuest/tonemaker/tone-spec.schema.json",
  "title": "POD Go Tone Spec",
  "description": "Declarative description of a POD Go preset that `tonemaker build` turns into an importable .pgp. Emitted by an LLM from the knowledge pack.",
  "type": "object",
  "required": ["name", "blocks"],
  "additionalProperties": false,
  "properties": {
    "name": {
      "type": "string",
      "description": "Preset display name.",
      "minLength": 1,
      "maxLength": 32
    },
    "blocks": {
      "type": "array",
      "description": "Signal chain. Up to 10 blocks; positions must be contiguous from 0.",
      "minItems": 1,
      "maxItems": 10,
      "items": {
        "type": "object",
        "required": ["model", "position"],
        "additionalProperties": false,
        "properties": {
          "model": {
            "type": "string",
            "description": "Exact POD Go @model id from the library (e.g. HD2_AmpCaliRectifire). Validated against models.json.",
            "pattern": "^HD2_[A-Za-z0-9_]+$"
          },
          "position": {
            "type": "integer",
            "description": "Chain order 0..9; block-key index equals position.",
            "minimum": 0,
            "maximum": 9
          },
          "enabled": {
            "type": "boolean",
            "description": "On/off in dsp0. Default true.",
            "default": true
          },
          "params": {
            "type": "object",
            "description": "Parameter values for this model. Keys must be among the model's known params; amp/drive/mix knobs are 0.0-1.0, freq/cut in Hz, gain/level in dB.",
            "additionalProperties": {
              "type": ["number", "boolean", "integer"]
            }
          }
        }
      }
    },
    "input": {
      "type": "object",
      "description": "Noise gate overrides (dsp0.input).",
      "additionalProperties": false,
      "properties": {
        "noiseGate": { "type": "boolean" },
        "threshold": { "type": "number", "description": "dB, e.g. -56" },
        "decay": { "type": "number", "minimum": 0, "maximum": 1 }
      }
    },
    "output": {
      "type": "object",
      "description": "Master output overrides (dsp0.output).",
      "additionalProperties": false,
      "properties": {
        "pan": { "type": "number", "minimum": 0, "maximum": 1, "description": "0.5 = center" },
        "gain": { "type": "number", "description": "dB" }
      }
    },
    "snapshots": {
      "type": "array",
      "description": "Up to 4 snapshots. Each overrides per-block bypass and snapshot-controlled params (wired via controller 11).",
      "maxItems": 4,
      "items": {
        "type": "object",
        "required": ["name"],
        "additionalProperties": false,
        "properties": {
          "name": { "type": "string", "maxLength": 16 },
          "bypass": {
            "type": "object",
            "description": "blockKey -> on/off for this snapshot.",
            "patternProperties": {
              "^block[0-9]$": { "type": "boolean" }
            },
            "additionalProperties": false
          },
          "params": {
            "type": "object",
            "description": "blockKey -> {param: value} held for this snapshot.",
            "patternProperties": {
              "^block[0-9]$": {
                "type": "object",
                "additionalProperties": { "type": ["number", "boolean", "integer"] }
              }
            },
            "additionalProperties": false
          }
        }
      }
    }
  }
}
